numero,nome,provenienza,data_nascita,anno_immatricolazione,facolta,corso,data_licenza,titolo_tesi_licenza,segnatura_archivistica_tesi_licenza,data_laurea,titolo_tesi_laurea,votazione_laurea,segnatura_archivistica_tesi_laurea,carriera,autore,revisore
1,Tatti Giovanni Maria,Cagliari,17-01-1834,1838-1839,Medicina,Chirurgia,1708-1709,"De sermone, quo primitus concripti sunt sacri libri, eorumque variis interpretationibus",Biblioteca Universitaria F.A 1024,1708-1709,De Divino Danielis opere,Approvato con tutti i voti,Biblioteca Universitaria F.A 2476,Conseguì la licenza il 1709-03-12 e la laurea il 1709-03-13,Zedda Valeria,Todde Eleonora
2,Pischedda Francesco Antonio,Cagliari,17-01-1834,1838-1839,Medicina,Chirurgia,1709-1710,De locis propheticis libri Geneseos,Biblioteca Universitaria F.A 1024,1709-1710,"De Anima Jesu Christi, atque ejus scientia",Approvato con quattro neri,Biblioteca Universitaria F.A 2476,Conseguì la licenza il 1709-10-08 e la laurea il 1709-10-08,Zedda Valeria,Todde Eleonora
3,Mastio Pietro Maria,Bosa,17-01-1834,1838-1839,Medicina,Chirurgia,1709-1710,De processione Spiritus Sancti ex Filio contra graecos schismaticos,Biblioteca Universitaria F.A 1024,1709-1710,"De Nahumo, et reliquis minoribus prophetis",Approvato con. pieni voti,Biblioteca Universitaria F.A 2476,Conseguì la licenza il 1709-11-20 e la laurea il 1709-11-27,Zedda Valeria,Todde Eleonora
4,Bissoni Antonio,Oristano,17-01-1834,1839-1840,Medicina,Chirurgia,1709-1710,De legum interpretatione,Biblioteca Universitaria F.A 1024,1709-1710,Pro Socio,Approvato con. tre voti contrari,Biblioteca Universitaria F.A 2476,Conseguì la licenza il 1710-02-07 e la laurea il 1710-02-08,Zedda Valeria,Todde Eleonora
5,Marongiu Diego,Cagliari,17-01-1834,1840-1841,Medicina,Chirurgia,1709-1710,"De mero, et mixto imperio, et de jurisdictione",Biblioteca Universitaria F.A 1024,1709-1710,"Depositi, vel contra",Approvato con. tutti i voti,Biblioteca Universitaria F.A 2476,Conseguì la licenza il 1710-02-15 e la laurea il  1710-02-18 ,Zedda Valeria,Todde Eleonora
6,Marras Pedro Antoni ,Aritzo,17-01-1834,1840-1841,Giurisprudenza,Chirurgia,1710-1711,"De multiplici saliva oris, ventriculi, et intestinorum",Biblioteca Universitaria F.A 1024,1710-1711,De nitro,Approvato con. tutti  i voti,Biblioteca Universitaria F.A 2476,Conseguì la licenza il 1710-11-21 e la laurea il 1710-11-28,Zedda Valeria,Todde Eleonora
7,Sadorro Lecca Juan ,Iglesias,17-01-1834,1840-1841,Giurisprudenza,Chirurgia,1710-1711,"De chylo, et lacte",Biblioteca Universitaria F.A 1024,1710-1711,De mercurio,Approvato con. due voti negativi,Biblioteca Universitaria F.A 2476,Conseguì la licenza il 1710-12-15 e la laurea il 1710-12-16  ,Zedda Valeria,Todde Eleonora
